<?xml version="1.0" encoding="UTF-8"?>
<Zahtev_za_zeleni_sertifikat
    xmlns="http://www.ftn.uns.ac.rs/xml_i_veb_servisi/zahtev_za_sertifikatom"
    xmlns:xsi="http://www.w3.org/2001/XMLSchema-instance"
    xmlns:jxb="http://java.sun.com/xml/ns/jaxb"
    xmlns:pred="http://www.ftn.uns.ac.rs/xml_i_veb_servisi/rdf/zahtev_za_sertifikatom/predicate/"
    xsi:schemaLocation="http://www.ftn.uns.ac.rs/xml_i_veb_servisi/zahtev_za_sertifikatom ../schema/zahtev.xsd"
    about="http://www.ftn.uns.ac.rs/xml_i_veb_servisi/zahtev_za_sertifikatom/0101000000110/2020-01-01T04:04:00"
    email="gradjica@maildrop.cc">
    <Podnosilac_zahteva>
        <Ime property="pred:ime">Rifka</Ime>
        <Prezime property="pred:prezime">Dinic</Prezime>
        <Datum_rodjenja>1992-02-02</Datum_rodjenja>
        <Pol>Zenski</Pol>
        <Jmbg property="pred:jmbg">0101000000110</Jmbg>
        <Broj_pasosa property="pred:broj_pasosa">111111111</Broj_pasosa>
        <Razlog_podnosenja_zahteva>Trebamo kod teodore na more ponovo</Razlog_podnosenja_zahteva>
    </Podnosilac_zahteva>
    <Zaglavlje>
        <Mesto_podnosenja_zahteva>Novi Sad</Mesto_podnosenja_zahteva>
        <Dan_podnosenja_zahteva property="pred:dan_podnosenja_zahteva"
            >2020-01-01T04:04:00</Dan_podnosenja_zahteva>
    </Zaglavlje>
    <Status property="pred:status">na cekanju</Status>
    <Sertifikat property="pred:seeAlso"/>
</Zahtev_za_zeleni_sertifikat>
